Date,PostID,Title,Content,Score,Comments,URL
1740171440.0,1iv1hmw,VOLD calculation??,"Anyone know from the indicator at this time stamp in this SMB tutorial (link below) how they're getting this ratio? I only see a couple of not very popular options on TradingView and I don't think they're quite tracking it the same way. VOLD itself as a market internal shows massive numbers and isn't really giving me a ratio, do I take the UVOL and DVOL internals individually and divide the greater by the lesser to get the same ratio or are they looking at something else like VOLD divided by total volume ($TVOL)?  


I like the idea of setting alerts for a 3+ ratio among other factors like where $ADD is holding so that I might know when to either size up or extend my take profit strategy for that period, hoping for a greater follow-through, but I don't even know how they're getting this ratio and they don't explain it in the video. It seems like comparing the % distance of VOLD from a 5-day moving average might produce something usable but I'd rather use what others have already found to work.  
  
[https://youtu.be/wkuR2Z0IVhQ?t=1271](https://youtu.be/wkuR2Z0IVhQ?t=1271)",1,0,https://www.reddit.com/r/Daytrading/comments/1iv1hmw/vold_calculation/
1740170510.0,1iv14bh,How do you know if a stock will be a whale 🐳,"
I made 9% from MLGO today but obviously got out early as it flew over 500% +. What tools, indicators, knowledge do you use to differentiate between stocks that go up 50% to the ones that fly 200-500%? ",0,4,https://i.redd.it/0pk9cexc0kke1.jpeg
1740170022.0,1iv0x70,If I would’ve held shorts today,"Nothing hurts more than hindsight 😭😭😭
Went short this morning literally when the market starting dumping with 1 contract. Sold for 1170, just for it to go to 8k + a few hours later 

Sighhhh",1,14,https://i.redd.it/s9tx37jwyjke1.jpeg
1740169830.0,1iv0uco,Starting up again,"I’m 19,turning 20 in a couple months going to finance school for merging and acquisitions I’ve been trading on and off for 2 years going on 3 with little to no profit on a live account,trading forex,futures,commodities,etc. I’m not trying to get rich or famous by any means through trading just trying to able to gain experience for my career and make some extra cash for internships and school,so finally decided to take things seriously this year and start up a new demo with a new strategy. The strategy I’m using is trend lines and I’m currently trading forex.I’m seeking advice on what I can improve on,been working on my psychology but it’s hard to believe I deserve to make money because of my low income background as my family is agriculture and blue collar based any advice would be greatly appreciated.Here’s my strategy set up and profit for the week…",1,0,https://www.reddit.com/gallery/1iv0uco
1740168420.0,1iv0ak4,SOLUSDT : From 60€ to 1300€ then -5k €,"I’ve started experimenting training months ago in fall 2024. 

I’ve lost some hundreds of money but nothing really worrying, I was gambling at the beginning. But slowly, I’ve became better. 

In December, I’ve put 60€ in Kucoin, and doubled it the first day, then went to 200€ then 250€ until I’ve reached 600€. 

I’ve started feeling invincible knowing than I could x10 in 10 days. I even became obsessed with trading, from waking up to going to sleep (late). 

During that weekend, I’ve traded non stop and went from 600 to 900 Saturday, then from 900 to 1300 Sunday, but I was so excited that I was shaking, checking my phone every second, thinking that I could reach 10 k in a month. 

I was so sleep deprived that I sleeped on a trade and woke up close to liquidation. I was left with 170€. 

It was 5 am and I couldn’t help but throw the 170 with high leverage as a desperate attempt to get more. I’ve lost it in a second, then started throwing my own money. 

I have started compulsively trading and I couldn’t stop. I’m very predisposed to addiction because I can have poor self control (when sleep deprived). 

I kept throwing money until I’ve lost a bit more than 4k in 2 weeks. I feel bad, ashamed, hopeless and in the verge of committing bad things. 

I know it wasn’t just luck but I also know that  risk management was poor. 

I’m thinking only trading a prop firm challenge, until I prove myself that I can be disciplined enough. Also limiting myself to one challenge account per week if I blow it up, to limit losses….

I’m feeling depressed and worthless…

What are you thoughts , advices ? 

Have you been through this then got better at trading ?

",1,0,https://www.reddit.com/r/Daytrading/comments/1iv0ak4/solusdt_from_60_to_1300_then_5k/
1740168368.0,1iv09sz,New to day trading,"Hello, I'm from the UK and have just started day trading, I was just wondering if anyone knows the tax rate for capital gains as I also have a full time job, any advice?",1,0,https://www.reddit.com/r/Daytrading/comments/1iv09sz/new_to_day_trading/
1740168303.0,1iv08un,The Hardest part of trading...,"I have been trading for more than a year now and as a beginner I am getting much better. For me the hardest part of trading has been: ""Staying out of market and not trading"". If I am patient and stay out of the market when my setup is not showing up I can make money. The mindset of you need trade everyday is not correct in my opinion. ",50,20,https://www.reddit.com/r/Daytrading/comments/1iv08un/the_hardest_part_of_trading/
1740167859.0,1iv02bc,leaving money on the table,"how can i get over CONSTANTLY leaving money on the table? this put is currently up 1,5600% and i sold at 720%
i have been thinking about using a limit sell for the low of the contract per candle on robinhood which honestly seems tricky with options, but just in general, what strategies do you use to not leave money on the table? 
i've been trying to do more scalping but that inevidably leads me to this, over and over again. 
i bought this put at $0.14, sold at $1.22, now it's around $3.20 😭",1,0,https://i.redd.it/utjkwt5hsjke1.jpeg
1740165375.0,1iuz2qo,FreedomTeam Trading any experience?,"Hey I was contacted by 1 of the members of freedom team trading run by Jordan F . He has a YouTube channel aswel 

Any one took his course they seem fairly new and I couldn’t find a feedback on google hence asking ? ",2,1,https://www.reddit.com/r/Daytrading/comments/1iuz2qo/freedomteam_trading_any_experience/
1740164555.0,1iuyqvq,Financial Release Schedule,"Is there a place that lists when consumer reports, inflation reports, and Fed data will be released? I didn't see anything on FinancialJuice and I'm sick of getting blindsided by huge sell offs like today.",1,0,https://www.reddit.com/r/Daytrading/comments/1iuyqvq/financial_release_schedule/
1740162992.0,1iuy3rw,Still Over trading. Send Help,If I just walked away after the first half hour of reading I'd be up $12k over the past three days. Instead I'm up $2800 and gave most of it back to the market. How do you stop wanting more?,0,23,https://www.reddit.com/r/Daytrading/comments/1iuy3rw/still_over_trading_send_help/
1740161987.0,1iuxovu,is there a strategy for holding stock for the day,"I use to hold the highest gainer stock buying in premarket and selling during the open market. I have had some success, but following Ross Cameron's 4-5 mins hold I feel I am on a long loser streaks than I recall. I am a typical newbie who has been through the Fomo and greed. Is there such a strategy for holding during the premarket and selling during the open.",1,0,https://www.reddit.com/r/Daytrading/comments/1iuxovu/is_there_a_strategy_for_holding_stock_for_the_day/
1740161850.0,1iuxmw7,17 - looking to start,"I’ve been in and out of looking at trading for a while now. I’ve seen the profits (and losses) and was looking for help. Can anyone give me advice, something that you would tell yourself or that you wish you knew when you started? The best books and videos to watch and read? Currently i’ll only be learning on demo accounts obviously until i build up capital to learn with, but anything that can help break down the whole trading scene is appreciated. ",3,10,https://www.reddit.com/r/Daytrading/comments/1iuxmw7/17_looking_to_start/
1740160437.0,1iux20i,Is this guy Ross Cameron and his results real?,"I have been watching his videos for the past month or two, this dude never has a red day. And posts like 10 - 50k gain days everyday. 

And when he makes videos about him having a bad day, he “only” made like 8k. 

Is this guy real? How can you make that much daily and never have a losing day. ",215,184,https://www.reddit.com/r/Daytrading/comments/1iux20i/is_this_guy_ross_cameron_and_his_results_real/
1740159801.0,1iuwsew,Looking for advice from experienced Daytraders and Scalpers,"Hello,

My intention is to become a profitable trader, thats it. I have a job that pays well, but I want to learn the art of trading. I've been trading for about 4 months, and I have lost about 2500$. This is fine, I kind of knew I would lose money, and it was money I could afford to lose. Why did I do it if I knew I would lose the money? Well, my mindset when I started was that ""what if I can do this, and I end up paper trading and making good profit on paper, instead of real profit""? Yes, its a weird mindset to have. Anyway, I wanted to be honest so lets get to the point.

Everynow and then I see advice in here, that in order to become consistently profitable, one has to put in the **time** and find an **edge**/learn a **strategy** that works for **YOU.**

This I totally understand, and I've accepted that I will have to learn by paper trading, OR, trading 1 share at a time - otherwise I will probably blow up my account.

But what I find difficult is, when studying all the various strategies (reddit, youtube, books, etc.), how to filter out the ""bad ones""? Do I really need to start testing each strategy in a paper account for months and months to build a journal and see if it works or not, just to conclude ""nope, this is not profitable"", only to go to the next potentially bad one. Rinse and repeat.

Or, could we try to list down a few strategies that you, experienced day traders/scalpers, have learned to be profitable with? Maybe with a short explanation how it works, what is the edge, or information about where one can learn more about it? I think it would be easier to get started by having some direction.

  
Thanks, and sorry if this is the 1000th time this kind of question is posted!

",1,8,https://www.reddit.com/r/Daytrading/comments/1iuwsew/looking_for_advice_from_experienced_daytraders/
1740157512.0,1iuvu27,Anybody else catch MLGO?,Uses 5m break and retest and entered at $3.40. Seeing if this popped up on anybody else's scan,7,23,https://i.redd.it/ql2p9sgpxike1.jpeg
1740156390.0,1iuvdc9,Beginner trading - making £2400 my first month 🎀,"Using £2k, I have consistently traded every trading day, coming out on profit every day. My favourite to trade has been 3xPalantir - I have been using MACD on 1m/5m charts. 

I am a 26 year old girl, no background in finance - self taught. And I’m scared!!! I get in and out of the trades in probably less than 2 minutes. 

I’m seeing a lot of strategy discussions saying to stay away from only using MACD. 

What are the strategies that are great to use with MACD? Should I stay away from leverage (x3)?  I’ve kept a trading diary by scribbling down my trades - is there a good platform you recommend using? Also, what are the best video resources you found?

(Be nice. I’m just trying to retire and generate enough income (I don’t need much) for my dad who is a hardworking tradie working 12 hour days with a brain injury and who’s had 6 brain operations in recent years. I just want to consistently make enough to tell him to stop. Hehe.)

Thanks guys :) x",1,2,https://www.reddit.com/r/Daytrading/comments/1iuvdc9/beginner_trading_making_2400_my_first_month/
1740153516.0,1iuu7q8,"Do you think, Trading for a living possible?","Share your thoughts base on your experience. And if possible Why it is possible? And if not, Why it is not?

I watched many video or read books. Few trader say, It is possible. Few trader say, it's not. You need any side income, job.

What do you Think?",16,91,https://www.reddit.com/r/Daytrading/comments/1iuu7q8/do_you_think_trading_for_a_living_possible/
1740153051.0,1iuu16m,The Harsh Truth About Trading: Why Most Fail and Few Succeed,"I want to add my two cents about the high number of failed traders.

Let's say that your local hospital is short-staffed, and they decide to introduce a new offer to the public: you can come to the hospital and act as a doctor. Here’s how it would work: for every medical procedure that is administered properly, you would receive a great reward. The catch is, if you fail, you get sued and need to pay a fine.

You start watching YouTube videos on how to insert an IV, what medication to give patients, how to recognize certain diseases, and even how to perform surgeries. You firmly believe that you will be rich since there is no shortage of jobs, and there are thousands of opportunities available to you.

After countless hours of watching YouTube and reading books, a couple of weeks pass, and you decide to walk into the hospital. You have to deal with your first patient, and you remember everything you saw in the videos. You decide to start with the easy task of drawing some blood. It turns out you didn't know the correct procedure and had to try multiple times before hitting the vein. You start with a $1,000 fine, but you think everything will be fine since you will still get paid a bit for the bloodwork you managed to do, which will reduce the amount of the fine.

Then you receive a call from the lab saying that you used the wrong tube and they won't be able to use the sample you collected. You won’t get paid at all.

Your second patient comes in with a fever and a sore throat. You prescribe them Tylenol and tell them to rest. You get paid a few hundred dollars, and your confidence is through the roof! First completed job – now you really think this is for you, and that money will come easily.

Your confidence is built up so much that you tell yourself you’re ready for open-heart surgery. It starts off fine since you watched thousands of videos on the subject, but the lack of practice hits you hard. You cut too deep, and the patient passes away. You’re fined $100,000. Now you’ve lost all your life savings and learned the hard lesson that you need to practice more.

You repeat the process countless times, eventually concluding that this is a scam, that no one can work in the medical field, and that you were robbed of your hard-earned money.

You blame everyone but yourself for your lack of knowledge and practice. You think that if you were not capable of doing it, no one can. Little did you know, 99.99% of the other people who tried to follow the same route as you also failed. Now you believe even more that it was a scam.

Becoming a nurse, doctor, surgeon, etc., takes YEARS of study. They do internships, practice with the best, and won’t make it to the end of their studies if they are not good enough. They have put in countless hours, and they need to have a passion for healthcare and helping people. They need years and years of actual practice before becoming really good at what they do. It’s not something that is suited for everyone. It is not something that is easily attainable.

I don’t have the actual numbers, but if we were to look at the number of people who failed in the medical field after earning a degree, it would be significantly less than 99%. They had a system in place, they learned everything before day one, and they paid thousands of dollars to go to university to get the right information. They did not learn from a nobody on YouTube. They had mentors and did simulations before touching a real patient.

Are you getting where I’m going with this? You probably entered the complex field of investments without preparation. You thought that weeks, months, or even a couple of years would be sufficient for you to be good. This is not realistic at all. It’s okay to use what is available to you to learn, but don’t expect it to make you good in a matter of days.

Trading is not just about trendlines and volume. To be a good trader, you need much more. You need discipline, you need to open your mind to learn for the rest of your life, you need a system, you need risk management, you need knowledge about economics, etc.

If you come into this crazy world without any education, you will spiral endlessly and gain too much confidence when you have a lucky gain. You need to pay attention to what works, why it worked, and what doesn’t. If you’re really motivated, it is possible – just like it’s possible to become a surgeon – but no, it’s not for everybody.

It needs to be something you enjoy and are genuinely interested in, not just an easy way to make money.",13,23,https://www.reddit.com/r/Daytrading/comments/1iuu16m/the_harsh_truth_about_trading_why_most_fail_and/
1740152596.0,1iutuxv,What went wrong here? New trader practicing on paper trade break and retest strategy,I trade the 5 min opening range break and retest strategy and need some help/advice thank you. Was it my stop loss in a bad place? Price action looked good to enter the trade can someone help me with what went wrong ? ,7,27,https://i.redd.it/2uhaj173jike1.jpeg
1740152382.0,1iutrym,UPC big buy incoming,Heading to 1$ land ,1,0,https://i.redd.it/33jvjicgiike1.jpeg
1740151452.0,1iutey8,Quality volume,Just wondering if anyone knows what the ideal amount of pre market volume would be when trading stocks. For reference I’m trading the opening range breakout strategy.(ORB),1,0,https://www.reddit.com/r/Daytrading/comments/1iutey8/quality_volume/
1740150930.0,1iut7o6,Does anyone know why Margins on Ninjatrader have gone up today?,"Does anyone know of some news event/jobs report coming out today? Margins on the MES, went from $50 to $200. ",2,5,https://www.reddit.com/r/Daytrading/comments/1iut7o6/does_anyone_know_why_margins_on_ninjatrader_have/
1740149514.0,1iuso8x,Am i just gambling?,I don’t really follow any strategy or anything as i think it’s impossible to predicts where the narket is going to go. I merely just look for a pattern and take trades. For this one I saw lots of greed then many red so surely next is going to be green. Is this viable or am i just getting lucky. ,443,268,https://i.redd.it/algplc7x9ike1.jpeg
1740147807.0,1ius1st,Good luck today everyone!,Not saying to trade this just thought it was funny lol. Have a great day! :),17,2,https://i.redd.it/lc8bk9ju4ike1.jpeg
1740147669.0,1iurzz5,Pre-market/Post market Screener recommendation?,"Looking for something very specific:

Any screener that can scan for:  
A) Volume\*Price (volume at price)  
B) Relative Volume  
  
 DURING Pre-Market and Post-Market hours",3,0,https://www.reddit.com/r/Daytrading/comments/1iurzz5/premarketpost_market_screener_recommendation/
