Date,PostID,Title,Content,Score,Comments,URL
1740199199.0,1ivaq3t,Robinhood bros first week day trading,"Trade mostly SPY options. I'm  in no way a professional. Just getting my feet wet to understand the emotional aspect of daytrading.

Earlier on in the week I lost 1k on a trade in a day but made it back within the next. My wins are small and sparsed out( 1-3 trades per day max.).

I didn't feel too bad  when I lost the 1k. I honestly felt I deserved it for being cocky so I was willing to give it to whomever was at the other side of the screen.

Any advice on risk management? Because I feel it's easy to make money, but harder to keep it.

I heard others say to be be patient in a trade but its hard to decipher if it's greed or patience to let a trade play out.",2,5,https://i.redd.it/6svtkswndmke1.jpeg
1740199034.0,1ivaogq,Ask about my risk case in The5ers High Stake,"Hello guys, i just passed phase 1. One problem is i had 1 big loss in my entire stage. I'm consistently risk less than 1%, just put SL in the key level and 99% of the time i closed SL and TP manually. That day i placed 2 position of gold, and have to go out on an emergency i cannot check the phone as i expected, i didn't forget to set a SL. And GOLD was going crazy, much faster than i supposed. 2 SL were hit, i loss more than 4% for 2 positions. This is the only day that i loss much as that, my biggest profit is much more than my biggest loss and i never increase the lot size in my entire stage. Is there any risk for my account? Or i just need to be more careful in stage 2?
",1,0,https://www.reddit.com/r/Daytrading/comments/1ivaogq/ask_about_my_risk_case_in_the5ers_high_stake/
1740197246.0,1iva5qi,How long before you can call yourself profitable?,"What’s the benchmark for being a “profitable trader”? Is it having a certain number of profitable months in a row? Being positive for the year? How many months of consistency do you think it takes—3, 6, or more? Curious to hear your thoughts. ",0,45,https://www.reddit.com/r/Daytrading/comments/1iva5qi/how_long_before_you_can_call_yourself_profitable/
1740196912.0,1iva282,Risk Management for my funded challenge,"I've been paper trading futures for a couple months, practicing with a $50,000 account. I have successfully ""passed"" TopStep's funded challenge (reach $53,000 without losing $2,000) a couple times and I'm gonna start the actual challenge next week. I wanted to share my risk management strategy here to hopefully get some feedback before I really go for this thing. 

I will be trading MES because it gives me more flexibility with my stop-loss and contract size. I risk about a half a percent per trade so that it takes 8 losing trades to hit the MLL of $2,000, versus 4 trades at 1%. Trading ES just makes it too risky I think because with those risk rules I can only trade 1 contract and have very limited range with my stop loss (I usually target highs/lows which can vary, not always fitting within 20 ticks). With MES, I can trade more contracts to be able to take partials and leave runners while staying well within my risk rules. I know this approach will take me longer to reach $3,000 profit, but it seems like the smarter thing to do because I have confidence in my strategy.

If I'm missing something glaring or you have any input please let me know, especially if you have experience passing these funded accounts. If this is good risk management, also let me know so I can let 'er rip. Thanks",1,0,https://www.reddit.com/r/Daytrading/comments/1iva282/risk_management_for_my_funded_challenge/
1740193056.0,1iv8wbw,Spread betting or CFDS,"Hi all, I’ve recently started day trading and I’m doing quite well, I’ve been reading up on the tax side of things (I’m in the UK by the way) I’ve read that spread betting is tax free but trading CFDS is taxed and I’ve realised that I have no idea what I’m actually trading! I know they are similar but Is there a way I can find out if I’m spread betting or not? I’m using vantage markets and have pretty much been exclusively trading EUR/AUD. 

TIA",3,9,https://www.reddit.com/r/Daytrading/comments/1iv8wbw/spread_betting_or_cfds/
1740192870.0,1iv8u9f,Quick question,If I close this Bull credit spread . Would I get that 220 profit? ,7,3,https://i.redd.it/ndw3ebeuulke1.jpeg
1740189459.0,1iv7qom,TEM down 21%,"What do you think of tempus? It’s down 21% this week after posting 90% returns over the last month. 

Going to have to keep an eye on this Monday pre market to see how it’s doing.
",1,3,https://www.reddit.com/r/Daytrading/comments/1iv7qom/tem_down_21/
1740187291.0,1iv70sp,VX for the win again today,"My post about the VX being one of my key indicators yesterday got no love. Well VX broke that level that I mentioned and the sellers found strength exactly as I mentioned. Was grateful to catch a real nice piece of that short on MNQ. I only wish I had leveraged higher and also entered a position on MES. This isn't Pokémon, you can't catch 'em all.

For those of you that are curious why the VX can be tied to overall market sentiment, it's because it is directly correlated to SPX options. A lot of the big dawgs in the market trade SPX options. If the VX is rising and breaking significant levels of resistance, it's because the big dawgs are buying puts on SPX. I hope a lot of you made money today, great end to my week for sure!",1,2,https://www.reddit.com/r/Daytrading/comments/1iv70sp/vx_for_the_win_again_today/
1740187183.0,1iv6ziq,Ever thought that whoever you are as a person is showing in your trading activities?,"Most days are a green day for me but then there's one red day in the week and it's a damn blood bath because of poor risk management. Then it dawned on me, this is how I run my life as well, particularly my (past) relationships. 

I think I can put up with a low quality setup. I ignore all the red flags and enter a trade knowing it's a trap. I like holding on to a trade thinking I can fix it. I don't know how to set my boundaries. I often don't set a stop loss and in a fight, flight or freeze situation, I freeze like when the trend is violently going down I just stare at my screen in awe of what's happening. I fall for losers all the time and stay in it for the long term cause my screener can't find anything better. I'm also impulsive and obsessive.  ",13,14,https://www.reddit.com/r/Daytrading/comments/1iv6ziq/ever_thought_that_whoever_you_are_as_a_person_is/
1740186718.0,1iv6u0b,Computers,"Hi I have a couple of laptops, one chromebook and the other windows 11.  If I run Think or Swim, and Nasdaq, or Barchart, Momoscreener, Stocktwits, pretty soon my Chromebook will freeze up, and also the Windows laptop. What level of processor and memory do you all use?

Thanks

",0,0,https://www.reddit.com/r/Daytrading/comments/1iv6u0b/computers/
1740186539.0,1iv6sg1,Will FTMO have an issue with my two account strategy for passing?,"I got 2 10k Evaluation accounts with FTMO and put in a buy on one and a sell on the other during news. This is how I passed stage 1 to save time.

On stage 2 of this account I now only need £100 more to pass which normally takes me 5 days to make.

I recently saw that this could be against the rules but they have not said anything to me yet. Will this be an issue when I pass?

Any response is appreciated thank you guys and happy trading.",1,0,https://www.reddit.com/r/Daytrading/comments/1iv6sg1/will_ftmo_have_an_issue_with_my_two_account/
1740185300.0,1iv6pby,4 years in - looking for advice to fix my trading problems,"I started trading 4 years ago. The last 3 years full time. I am in financial situation where I don't need ""a salary"" to pay the bills so I've been able to focus on my trading (like a student at university or something like that). 

Here's a brief summary of my situation at this point:

1. My technical analysis is quite good  
2. My trading edge is clear and defined for me  
3. It took me a long time, but I know exactly what I have to do in order to do profitable trades.  
4. I know all the aspects of my strategy from the entry criterias to my ""trailling stop"" rules  
5. My BIGGEST problem is on the mental side, THAT is what's causing me to be unprofitable at this point.  
6. My drawdown is currently approx 5% of my account per month (used to be a much bigger number)

7. I only trade small size because I'm trying to prove myself profitable with small money before using big money. Therefore the drawdown isn't putting a huge strain on my finances (thank God)

To elaborate on #5 which is the cause of my problems:

I DO NOT have a ""calm/ultra disciplined"" personality. I'm a rather creative/analytical person (I'm a mixture of LEFT side + RIGHT side of the brain). I have trouble with being disciplined and not acting out of impulse sometimes. I have a tendancy to overtrade despite my being aware of the problem. I've got the hardest time doing the same thing day in, day out. I'm a rather intense person and I'm struggling with being calm/steady/repetitive

I know exactly what I have to do but its hard for me to reshape my psychology. Here's an example of my bad behaviour:

A) I tend to usually stay up until midnight and wake up around 6:30-7:00AM

B) I have trouble leaving my screens at times... meaning, I tend to want to ""trade everything"" and I have trouble being ""satisfied"" once I have made decent trades in the day.

C) It feels oddly counter intuitive and irrational, but I have a feeling my using small size is sometimes the reason I tend to keep trading. I can easily make 10-20r (risk to reward) in one day but give it back through overtrading. In other words: My using a 5-10$ per trade risk, means when I'm done trading in the morning, I'm up 10x to 20x 5$ to 10$... so in other words: 50$ to 100$ profit usually. And obviously, since the goal is to become a full time day trader, when my eyes see 50$-100$ they fail to see the big picture of (compounding gains/interest)

D) In terms of personality I have a really weird mix to deal with here because:

\- In life I'm generally not the ""boss"" at a given job, I'm usually the #2 guy. I'm not the very best at taking on as much initiative and responsibility as a ""boss"" does. I usually excel and outperform when placed under good leadership  
\- My near perfect balance between left/right side of the brain means I'm both creative and analytical. 

  
Conclusion: My personality is both my greatest strength and weakness. I always loved research and analysis in the past. I LOVE to teach myself stuff. I'm also ultra determined and do not ever give up until I get what I want. I'm usually LESS productive than other people because I spend the extra time required to figure things out, but that also means I sometimes waste time more compared to others.

Basically, I'm looking for advice on how to deal with my mental/personality flaws as a trader. If I could follow my rules better and avoid overtrading (trading after hours or too much in the afternoon) I'd be set. I'm also at this point where I'm really questionning what to change and what to do different.

  
I also manage my kids RESP and my own RRSP. Both these accounts are doing better than my margin account. It seems its easier to manage money you ""don't care about"" too much (or not emotionnaly affected). Its also possible at this point I just need to take a break to reset. When I say I spent 3 years full time, full time would be an understatement, I spent countless hours working/journaling/reviewing/refining my edge. 

TLDR: I spent a LOT of energy on ""technical analysis/refining my edge"" but my MUCH BIGGER problem to contend with is fixing my ""BEHAVIOUR"" problems/discipline.

Any advice and feedback would be much appreciated. 

",4,18,https://www.reddit.com/r/Daytrading/comments/1iv6pby/4_years_in_looking_for_advice_to_fix_my_trading/
1740185163.0,1iv6nsi,Why is golden sun health technology up 50% after hours?,If anyone has any news on why this company is up 50%+ GSUN is the ticker. Is this one of those microalgo where it will continue to go up? ,1,0,https://www.reddit.com/r/Daytrading/comments/1iv6nsi/why_is_golden_sun_health_technology_up_50_after/
1740184385.0,1iv6e97,Crude Oil Futures Forecast,"Huge short ready to play out next week! 

Been watching this range for a while and now looks ready to break, whilst also waiting for this pullback to load up on a huge long. This trade can be played both ways if you’re patient.",1,12,https://i.redd.it/fzo0tdyl5lke1.jpeg
1740184151.0,1iv6bdh,Taxes,"For the guys here that day trade full time , how do you guys file your taxes ? Through an llc ? 
I do know what whatever you make from trading you would take full profit numbers and roll that on with your yearly salary ( W-2 ) but was just curious . Tax thresholds ? I’m confused lol ",1,1,https://www.reddit.com/r/Daytrading/comments/1iv6bdh/taxes/
1740184150.0,1iv6bd0,Gold Futures,"Price holding up at the upper range of this month, the expectation for $3k could hit next week with money expected to flow into gold following poor economic data this week.



",1,0,https://i.redd.it/fgk4ugww4lke1.jpeg
1740184132.0,1iv6b5v,Can someone explain what this kinda ETF is like I don't understand this at all,"https://preview.redd.it/3joaqmui4lke1.png?width=1063&format=png&auto=webp&s=6a8061a9f492b6a109ba6d18143f6d708e05307d

How does this work. What is this kind of fund. What do they do in building/managing a fund to make this kind of thing occur. It looks like the graph of a rugpulled coin lol (but over years not hours/days ofc)

(I know this isn't really ""daytrading"" but I get better advice here pls don't remove)",1,1,https://www.reddit.com/r/Daytrading/comments/1iv6b5v/can_someone_explain_what_this_kinda_etf_is_like_i/
1740184099.0,1iv6ara,"How I Made $1,330 Shorting a 30-Minute Cycle High (Step-by-Step Breakdown)","One of the biggest struggles in trading is knowing what to do when you don’t have a clear bias. If you’ve ever felt lost trying to figure out direction, this breakdown might help.

📌 My Approach When There’s No Bias

When I don’t have a directional bias, I rely on 30-minute cycle highs and lows as key POIs. These levels often act as natural turning points where price either rejects or breaks with conviction.

📉 The Setup: Shorting a 30-Minute Cycle High

1️⃣ Identifying the POI:
	•	My key point of interest (POI) was a 30-minute cycle high.
	•	Price violated the high but then rejected with force.
	•	Confirmation: A Fair Value Gap (FVG) formed below the 30-minute cycle high, reinforcing resistance.

2️⃣ Why This Was a High-Probability Short:
	•	I boxed the 30-minute cycle high to observe how price reacted.
	•	When price left the high aggressively, it confirmed weakness.
	•	Underneath the 30-minute cycle high, there was a 1-minute FVG, acting as a true support.

3️⃣ Execution:
	•	Price retested the 1-minute FVG inside my boxed area and held as resistance.
	•	As soon as price rejected and displaced lower, I entered a short position.

4️⃣ Risk Management:
	•	When price left multiple FVGs behind, I secured my stop-loss at +$70 to eliminate risk.
	•	First take profit: 10 contracts were closed at the previous 30-minute cycle low.
	•	Final take profit: Remaining 10 contracts were closed at the 1-hour FVG.

🧠 Key Takeaways
	•	When no bias, use cycle highs/lows for entries.
	•	FVGs at key levels act as strong confluence.
	•	Box your POI → Watch how price reacts when it leaves the level.

💬 How do you approach trades when you have no clear bias? Let’s discuss!

🔗 Full trade breakdown available  🎥 Check my profile for details!",0,0,https://www.reddit.com/r/Daytrading/comments/1iv6ara/how_i_made_1330_shorting_a_30minute_cycle_high/
1740183824.0,1iv67dx,Referência de checagem e peso de importância de cada dado analisado em planilha excel e mapas mentais de estudos,"[Também hierarquizei as dúvidas na parte em vermelho usando formatação condicional, a parte verde é algo que ainda irei fazer, referente a padrões de candle e seu peso de relevância para análise, de forma que ao checar todas as coisas que encontrei em um gráfico que tornam o meu trade mais convexo, poderei mensurar com base no somatório de pesos o quão convexo é aquela operação](https://preview.redd.it/8wzuhifj2lke1.png?width=1253&format=png&auto=webp&s=d68e836424a81525879c166e8e820b80a6c387dc)

[Nessa parte está incluso coisas que não são válidas pra análise, para que após um back teste ou forward test, seja validado que os que estão em vermelho realmente tem um peso baixo](https://preview.redd.it/r48mz6gn2lke1.png?width=414&format=png&auto=webp&s=37f71b9bd56d1ea5db857ad05668d1bff8470015)

[Os em ciano a esquerda contém informações e dúvidas sobre o mercado de cfds, a direita em amarelo é sobre o mercado de hold, também há imagem e diagramas que sintetizam ideias e setups, ambos estão conectados no meio com coisas que estão relacionadas aos dois, hoje em dia eu faço mais hold, mas pretendo me tornar consistente em futuros em breve, abaixo são os gráficos que analiso e acima uma organização de tudo de forma geral, hierarquia de mercados e modalidades, estratégias de gestão e trabalhos que estão sendo feitos ](https://preview.redd.it/4h1mhonf3lke1.png?width=1164&format=png&auto=webp&s=303693258027071cbd12eb4def92130302464d5a)

",0,0,https://www.reddit.com/r/Daytrading/comments/1iv67dx/referência_de_checagem_e_peso_de_importância_de/
1740183687.0,1iv65mq,Copper Futures Forecast,"The market looks primed to roll back to the monthly opening price after some sideways action this week. With price coiling at last week’s lower range, expectation is this to play out as a distribution phase next week with a liquidity sweep to take out early shorts and trap longs.

Poor economic data to support this idea with housing starts coming in softer than expected as well as existing home sales falling short of forecasts. 

Good next week luck traders!",1,0,https://i.redd.it/0rz9n6bj3lke1.jpeg
1740181622.0,1iv5erz,started $200 to $10k+ challenge and now at 1k+,"doing these small acc challenges to show y’all 
following the trend , patience , entering with confirmation & simplicity is the key to trading 🔑

last 2 post is the trade i hit today as well for an 300%+ gainer on $QQQ 

for the last trade i seen that $QQQ didn’t make new highs on the higher time frame telling me that price is now bearish , if price is in a bearish trend that means you look for sells/puts , waited for price to retest a prev support area and waited for confirmation and entered 




",45,11,https://www.reddit.com/gallery/1iv5erz
1740180707.0,1iv534w,Can someone help me figure out how to calculate my lot size?,"https://preview.redd.it/zp47tdd2ukke1.jpg?width=643&format=pjpg&auto=webp&s=71486347fba642d3b906c2b402562411976df77e

https://preview.redd.it/c00avuc2ukke1.jpg?width=639&format=pjpg&auto=webp&s=31c392575b2f981b797f2015a2445306494c8a2a

I asked customer support at Maven Trading about contract size and they pointed me to ""point size"" and ""min. position size"". This may be a dumb question, but how do I figure out my contract size using this information?",1,0,https://www.reddit.com/r/Daytrading/comments/1iv534w/can_someone_help_me_figure_out_how_to_calculate/
