Date,PostID,Title,Content,Score,Comments,URL
1740269859.0,1ivx6rs,I've built an app to log daily P/L,"I started trading before Covid, took a break, and recently got back into day trading. One thing that always frustrated me was how most brokerage accounts don’t offer a way to see P/L in a calendar format for each trading session. So, I asked AI to help me build a simple web app called Flippl to:

* Log my daily profit/loss
* View trading sessions in a calendar or a chart
* Export all trade data to CSV for backup
* Generate a public link to share my all-time summary with others

Nothing fancy—just an easy way to keep track of my trades without digging through spreadsheets.

Check it out here: [https://flippl.app/](https://flippl.app/)

Please feel free to use it, and I'd love to hear any feedback or suggestions!

https://preview.redd.it/5vdtegvvzrke1.png?width=2992&format=png&auto=webp&s=f32f71de6acdddf96c88243b9ea74d999451acee

https://preview.redd.it/vqwd12etxrke1.png?width=2980&format=png&auto=webp&s=ef179f71434d5209b310e0d7ee6a4f11fa849a8e

",1,0,https://www.reddit.com/r/Daytrading/comments/1ivx6rs/ive_built_an_app_to_log_daily_pl/
1740269842.0,1ivx6k0,Very Red Friday = Green Monday | SPY Price Change Visualization,"https://preview.redd.it/869bjvs07ske1.png?width=3735&format=png&auto=webp&s=4d53cdee71232e7c7f8c034990553cea67aed595

I was playing around with some data on SPY from 2022 to present and figured out how to make a heat map in a calendar format based on the percent change from open to close. I didn't really see any major patterns in the data over that time period outside of what's already known - like, 2022 was volatile. 

However, I noticed that Monday's were generally more calm than all other days. And, although, some of the biggest red days in 2022 were Mondays, it still ended up being the 2nd best performing day of that year.

Fridays, on the other hand, are psychotic. Maybe its because people are trying to unwind all of their bad trades from the beginning of the week. I can't say, but the only thing this visualization does show about Friday's is that they can end up anywhere. It's like Monday's are the beginning of a wagging tail, and Friday's are the tip.

The one thing I did see that had a very strong probability was that very red Friday's (downward moves of 1.5% or more) seem to be followed by green Mondays. This does not take gaps into account. It's just based on ""closing price - opening price"". The data doesn't say ""buy at the end of the day on Friday"", but it does suggest that buying at Monday open after a -1.5% move, or greater, has, over the past few years had a great chance of being followed by a green Monday. 

If you see anything else, please share. 

Oh, and this past Friday had a move of -1.71%.",1,0,https://www.reddit.com/r/Daytrading/comments/1ivx6k0/very_red_friday_green_monday_spy_price_change/
1740269808.0,1ivx65u,COIN target?,"Will COIN come back down to close the gap? 
What price target are you waiting for to enter??",1,0,https://i.redd.it/yx81a0hm7ske1.jpeg
1740269703.0,1ivx4vp,RDDT target?,Will RDDT hold support or will it come down and close the gap???,1,1,https://i.redd.it/doahjz4b7ske1.jpeg
1740265400.0,1ivvndd,SL gets triggered by wick… candle continues to close above or below my stop loss. Is there a way to get around this?,"While looking through my trading log, I had a significant number of trades that failed due to this happening. I use TradingView to trade. Is there a way to make it so my SL only triggers when a candle closes, not if a wick hits it?",1,30,https://www.reddit.com/r/Daytrading/comments/1ivvndd/sl_gets_triggered_by_wick_candle_continues_to/
1740264223.0,1ivv87u,Is it frowned upon to not monitor my trades?,"So in funded 100k, but I’m also 18 years old. So I have a lot going on in life right now, two jobs and school on top of trading. Now I find myself setting trades with a SL and TP and forgetting about them. Is this frowned upon or general practice?",1,0,https://www.reddit.com/r/Daytrading/comments/1ivv87u/is_it_frowned_upon_to_not_monitor_my_trades/
1740262152.0,1ivuhbc,Is starting with prop firm a good idea?,I would consider myself a newbie but I have invested in stocks before and have done pretty decent swing trading considering I have limited funds. I have decided that I want to become a serious day trader and only have $7k to lose/invest. I have a Schwab and Robinhood account and am scared of accidentally being flagged as a pattern trader as I have sold some stocks intraday but only at around $500/trade. Which brings me to another question. Will Schwab warn me about pattern trading and give me a heads up if I did one? But my main question is if I’m willing to fork over $50/mth for a prop firm like Top Step is that a good way to learn and get started? Thanks. ,1,0,https://www.reddit.com/r/Daytrading/comments/1ivuhbc/is_starting_with_prop_firm_a_good_idea/
1740261972.0,1ivuev2,Alternatives to Trade by Matt for NQ,"Long time lurker. Thanks for all the good folks here. After looking all over the net and Reddit for live NQ traders, I found Trades by Matt. The others suggested here were too educational rather than live and focused on NQ.

I know most here think he is a fraud. I like him to point out key levels and blocks. I follow my own setup and not his. A shady part I noticed so far  is the one or two minute lag.

Is there a better live trader for NQ?",1,3,https://www.reddit.com/r/Daytrading/comments/1ivuev2/alternatives_to_trade_by_matt_for_nq/
1740261787.0,1ivucev,Over the last month I’ve lose 1500$,"Im thinking about taking a break as I’ve lost my last 3 checks trading. Before that I was actually profitable but this whole month it’s just been down. Never quitting tho I’ll be back even stronger💪🏾
",48,87,https://i.redd.it/fn0woorrjrke1.jpeg
1740259247.0,1ivtevn,I need help,"Started trading in october 2023 and since July 2024 I have been profitable, but I do not have enough capital and I am relying only on prop firm challenges which I tried to pass few but failed due to hidden rules and their bad market conditions.
What can I do to aquire a decent amounth of money to start trading with other than propfirms? (I cannot do it with a job because I live in a country where the median monthly income is $300 a month).",1,0,https://www.reddit.com/r/Daytrading/comments/1ivtevn/i_need_help/
1740258006.0,1ivsxvr,Does anyone use SMC and are you successful ?,"So just a quick one, I see a lot of people here trading contracts and such and I have no clue where to start with all that, but I have been learning about trading currencies using the SMC (smart money concept) does anyone else use this method and how is it going for you, any advice from a profitable trader using this would be amazing, thanks ",1,0,https://www.reddit.com/r/Daytrading/comments/1ivsxvr/does_anyone_use_smc_and_are_you_successful/
1740257992.0,1ivsxo8,What would you do?,"Need a little advice. On Thursday I took a trade on BRTX. Meant to buy 1,000, accidentally bought 11,000. As soon as I realized what I had done I should have sold (that’s way too big of a position for my account), but I didn’t sell, thinking I could handle the trade (As evidenced, I could not). 

Price tanked y’all. TANKED. In a matter of seconds I was down $1200. In a snap decision, considering the stock overall, I decided to hold the position as a swing trade and let it rebound, even if it took a few days. It dropped another $.16/share on Friday. I’m now down $4,900. 

I have cash in my account to continue to daytrade, but obviously this has tied up a lot of capital. And as much as it makes me nervous to have this much in one stock, I don’t want to take a $5k loss if I don’t absolutely have to. 

I broke my day trading rules and I know I made a mistake. I know, I know. 🙈(LESSON DEFINITELY LEARNED)

This is where I need help: 
Do I cut my losses and sell all 11,000 shares on Monday? 

Sell some of it to reduce my position size (at a loss) and let it rebound, even if that takes weeks/months? 

What would you do if you were in this position? 

What advice (besides don’t ever do this again) can you give me? 


",4,32,https://www.reddit.com/r/Daytrading/comments/1ivsxo8/what_would_you_do/
1740252338.0,1ivqsjr,TradingView Screener RVAT,"Hey guys, 

I'm starting to use the tradingview screener for my stock selection and I have a couple of doubts, specifically on the time interval.

If I use the time interval set to 1D, then the columns like ATR (14) and VOL (10) should be based on the last respective days.

However, If I add the Relative Volume at Time column, it should only work for 5mins bar according to:

[https://www.tradingview.com/support/solutions/43000635874-how-do-we-calculate-relative-volume-and-relative-volume-at-time/](https://www.tradingview.com/support/solutions/43000635874-how-do-we-calculate-relative-volume-and-relative-volume-at-time/)

So in the same screener (1D Time Interval) I can wait for the 5min closure on opening, then check the RVAT to see which ones are doubling or triplicating (example) comparing to the same period in the last 10 days, right?",1,0,https://www.reddit.com/r/Daytrading/comments/1ivqsjr/tradingview_screener_rvat/
1740252195.0,1ivqqjj,Does correlation hurt my win rate ?,"I know that each trade is independent, but what about mixing correlated/ non correlated trades , like taking 5 correlated trades today , and next day taking non correlated trades , is that a problem ? Each trade is independent is that still the case when correlated?
Thanks ",1,0,https://www.reddit.com/r/Daytrading/comments/1ivqqjj/does_correlation_hurt_my_win_rate/
1740250281.0,1ivpzf2,When to believe in your system?,"So I’ve a discretionary day trading system I’ve backtested for about 6 months and live traded for 10 months. (Been trading about 3 years in total im specially talking about my current main set up here).

The last 6 months have been profitable and each months profitability is trending up as I learn more price action and improve on my skills and gradually eliminating errors.

I’m just wondering are there any milestones or moments people have had when they finally fully trusted their system and realised they were consistently profitable?

I day trade the ES 5min chart. My system gets about 4-6 signals a day which I usually take 2-3. Win rate the last 90 days is 70%, profit factor around 2. Risk reward usually 1:1.",9,14,https://www.reddit.com/r/Daytrading/comments/1ivpzf2/when_to_believe_in_your_system/
1740246689.0,1ivok4c,My Daytrading Rules,"What do you think?

Don’t be scared of losing small. 
Be scared of losing big!

Trade either works or it doesn’t!!! Right away!

It is OK to admit you are wrong!

Do not trade on the way down!

Never average down!",48,18,https://www.reddit.com/r/Daytrading/comments/1ivok4c/my_daytrading_rules/
1740245841.0,1ivo7vn,Nq and mag 7 options,"I am new to trading, i paper trade nq and mag 7 stocks using mosly 0DTE options on webull, is this the best way to trade or is there another way ? ",1,3,https://www.reddit.com/r/Daytrading/comments/1ivo7vn/nq_and_mag_7_options/
1740245670.0,1ivo5dh,19 year old 200k in profit AMA. Verified on kinfo. SpatialTrader,"Hello traders, bored on a Saturday, answering any questions you guys might have, I’m a profitable 19 year old trader with 200k in profits. I’m verified on kinfo, the app says they sent a flair to modmail so should be showing and YouTube spatialtrader for proof.

Edit: I have answered several questions that are general questions so look to see if your question is answered before answering, and like zero upvotes:(",0,68,https://www.reddit.com/r/Daytrading/comments/1ivo5dh/19_year_old_200k_in_profit_ama_verified_on_kinfo/
1740244986.0,1ivnvgz,$55 away from being funded,"As the title reads, I’m most likely one trade away from being funded the downside to this is that my risk has decreased substantially and i mean substantially. At one point I risked only 1 micro to make $30. I was doing $800 trades risking 1 mini because i wasn’t as close to being funded. On Tuesday I took two trades that both could’ve got me funded. I exited early on both right before they shot up to TP. I only got out because of fear of losing. I’m so close I need to get over this. I’m thinking of risking more to get one tick in profit and exit but that’s just not how i work. I’m thinking of following a signal to get me funded but if i follow a signal that loses my money I’m actually gonna crash out. What should I do. I risk 6 micros because i’m so close.",1,1,https://i.redd.it/b26467dt5qke1.jpeg
1740243489.0,1ivn9cx,Leverage question,"Can you gents explain to me what I’m doing wrong here pls. So I start with 6177$ and end with 6153$ when my closing PNL is in the green with 29$. This was a short btw. 
",0,0,https://www.reddit.com/gallery/1ivn9cx
1740243212.0,1ivn5fv,Silver bullet proof,Wondering if anyone has truly gotten profitable with the silver bullet ict strategy. And if so do you have proof and any insight or a way to keep it clean and neat everyday.,0,3,https://www.reddit.com/r/Daytrading/comments/1ivn5fv/silver_bullet_proof/
1740235084.0,1ivk43d,When can you consider full time Day Trading?,What milestones do we cross before we can quit our day job and switch to day trading full time?,1,0,https://www.reddit.com/r/Daytrading/comments/1ivk43d/when_can_you_consider_full_time_day_trading/
1740234933.0,1ivk25m,"For Expiring Covered Calls, What do we do? Roll or let it expire and repick?","Am I doing a covered call strategy right? What do you do if it’s OTM at the end of the day? Roll the options or let it expire and repick and enter at another strike price? 

If it’s ITM what will you do?",1,0,https://www.reddit.com/gallery/1ivk25m
1740234702.0,1ivjzc6,Taking Losses,"The best traders I have met take losses like nothing. The position moves against them and without hesitation, they cut the trade. On the flip side, I personally find myself holding onto positions longer than I should because I am TERRIFIED that the moment I sell, the position will move in my favor and as we all know, that is next level pain. 

  
Any tips on how to move past this psych barrier? I obviously acknowledge the mistake, but in the moment, I keep repeating the same mistake over and over and it is slowly killing my account.",21,39,https://www.reddit.com/r/Daytrading/comments/1ivjzc6/taking_losses/
1740233777.0,1ivjo9s,apex trading payout,asking if the payout for apextrading is always going to be capped at 2k for 50k account or is it only for the first 3 payout? pls help me out here ,1,0,https://www.reddit.com/r/Daytrading/comments/1ivjo9s/apex_trading_payout/
1740233684.0,1ivjn45,What do trading furus and scammers do to keep their vicitms engaged for an extended period of time?,"I always wondered not that people get scammed but that many are being fleeced for multiple days, weeks or even months. It is one thing to get sold a large bridge once, but getting sold the bridge brick by brick over an extended period of time is an entirely different story for me.

If you ever were a victim of a chat room or an individual, or if you have ever brought a useless piece of advice or software, what were you told to keep you at it, while trying to fleece you for everything you have? 

When did you finally notice that you were actually being taken advantage of instead of getting the promised advantage over the market? 

What did they try to lure you back in once you had left, and were they successful at least once?

Were there any early signs that you are in for being robbed instead of doing the robbing early on? Why did you ignore these signs?

\---

Many thanks, and I am not just asking for a friend; I just have a genuine interest in the answer, as I would like to know if they all do the same or not and if they use more honey or more force when doing so.",0,4,https://www.reddit.com/r/Daytrading/comments/1ivjn45/what_do_trading_furus_and_scammers_do_to_keep/
1740230837.0,1ivipcs,How long did it take you to become profitable?,Curious about the journey of other traders here on reddit. Tell me about it!,16,61,https://www.reddit.com/r/Daytrading/comments/1ivipcs/how_long_did_it_take_you_to_become_profitable/
1740229729.0,1ivid3g,Websites and Information on Stock Market-Influencing Events?,"Yesterday significantly dragged down the index, seemingly due to a consumer expectations study that I believe was not particularly important. At the same time, we should not ignore the fact that these kinds of preliminary expectations and market surveys can influence investors. Because of this, I’d like to find websites that compile the daily forecasts or expected news items that might have such a market-moving effect. 

Do such websites even exist? Did anyone or anything indicate that the university survey could have such an impact on stock market developments?",1,2,https://www.reddit.com/r/Daytrading/comments/1ivid3g/websites_and_information_on_stock/
1740218189.0,1ivfflt,"I read almost every post here. I want to share. For a moment I felt like the best trader in the world. I was profitable for about 4 months and 40 trades. About %15 a week, daytrading, sometimes holding a position for 2 or 3 days at most.","Seeking ADVICE.   
I started trading about 5 years ago. I learned all the tricks and tips to being profitable very early on. No I didn't follow them. Following my methods I was profitable, but it is boring as shit and doesn't leave room for imagination. Through the years I've stumbled onto strategies that are profitable. I have 4 reliable and tested, and working on a 5th. Don't get me wrong, these are just simple set ups with little to no down side. The one that everyone knows, but it is not day trading, is just wheeling. You can make good money on that. But that's boring and tried and true for long term investors in stable stocks. The other ones seem complicated, but are simple, yet qualify as day trading, are very profitable yet never talked about. One of these gets me about 10% a month, and only requires me to make adjustments once or twice a week. A tad bit boring, but the money is nice. Then the one that I'd been testing last year, and I was scared to keep trying has been bold and it worked like a charm. 

I came up with this one on my own. I'm quite proud of it. I started with the goal of making 5% per trade. Ended up with wildly different results. About 1/4 of my trades ended up with 5-10% losses, which was definitely at times I shouldn't have been placing trades(like they all say). Other trades were wildly higher, since I dont have an upper limit of when I close, just when I feel like it is enough. I ended up making about 15% every week on average. I almost doubled my account every month for 4 months straight, while I also kept withdrawing some money and blowing it on nice things because that's what makes the sacrifice worth it. Recommend. 

Suddenly money was no object, and just like that money lost all value. The chaos of the 2 weeks of the pause in earnings and the chaos of January threw me off. I had days of randomly gambling on SPX (because I was trying to avoidwash sales, not trading on any of the regular names that I knew well, which i had traded in December), and after a few trades of making +10k, I just stopped thinking about my strategy. 

I no longer saw money as real, I didnt even care if I lost anymore, because I knew that I knew how to make it all back if I felt like it. Insane. I know you must be thinking that I was probably lucky and manic, which is all i could think too. But the funny thing is that I stopped putting money into the market last year because I became profitable. I don't need any of the money anymore. I realized that I literally was trying to get profitable so that I dont have to put any ""real"" money into the market anymore and not have to try to explain to my wife why I needed more. Now, I'm free. My wife has left me. Lol, jk. Now, i get to extract money and buy stuff for her. 

So where is the problem? Well, since I can't feel anything from the money anymore, I'm just throwing money into 0dte SPX options to see if I can catch the trend and day trade those options. Honestly, it's the fact that 1 word from 1 person can throw the market into turmoil any day, with the market being so fragile to headlines, I don't find my own strategies that profitable on a day to day basis. For instance, I can recover all my losses in a single trade, and I have multiple times this year-to-date alone. Today I just didnt even care, so I slept in and didnt trade; missed opportunity. 

So far, I have basically lost 50% of my profits from the point that i became profitable. But I guess I just look at it as just house money now. Also, this is the second time in the past 2 months that I have lost and made back and lost that same amount. So again... no lesson learned, so I'm still considering it daytrading but IDK.   
  
The thing is, how much money do I need to be happy? Not too much I think.   
Another thing that I realized was that I was worried about money, and I needed money to solve the problems of money. Which it did. But once I had all the money I needed, and money became meaningless, all the other real life problems became glaringly clear. I realized that the Money didn't give me extra time with my kids, and it didnt give me extra time with my wife, and it didnt even give me extra time because I was still trying to earn money. Honestly maybe im just depressed about the state of the world. I'm no fan of stress. 

So anyway...I guess i'm writing this because I have no one else (other than my wife who listens but doesnt understand what i'm doing or going through) to talk about this stuff. 

Sorry, I went off on a tangent. But I guess it is relevant to the advice that i'm seeking. I don't know what to do. I feel like I stumbled onto something that seems too good to be true, but has proven pretty real so far. I'm afraid of finding out that I was actually just a moron getting lucky every month, and that I should quit while I'm ahead. I tried to test it, using the 40 trades thing, and I feel like that gives it legitimacy. I don't know how much I can scale it, but I'm a small fish still. Should I just continue on with the trading even though I find it just so boring now. What really excited me was discovering and testing new methods and strategies. And that's why i'm always working on something new even though i have a few easy ones that already pretty much guarantee money. I have one that literally guarantees that i'll make money, but just takes a longer time frame. It did 5x over the course of about 5 months, and the win was guaranteed, but the amount wasnt. Anyway, I'm not sure if im allowed to make any statements without providing receipts, but I just need someone to understand what I'm going through, and maybe someone who has had a similar problem. I definitely have imposter syndrome. I also have a problem with doing the same mundane repetitive tasks, especially without co workers. I don't think people really realize how lonely it is without co workers. I wish I could have a nice normal desk job, but I have no skills. I could probably fill out excel sheets by hand, but AI is already doing that job now. I was thinking of going to work at a local coffee shop so I can have someone to talk to. 

P.S. Forgive me, I hope you will understand that I cannot share my methods. I am here for YOUR advice on daytrading lifestyle. The only advice I can give is that you should follow the advice that you see repeated on this sub over and over, the same 5 rules or something; i promise that if you are to ever become profitable, it will not be without following those rules. ",0,16,https://www.reddit.com/r/Daytrading/comments/1ivfflt/i_read_almost_every_post_here_i_want_to_share_for/
1740215699.0,1iveuzw,Open Source Algo Trading Framework With Free Heatmap & Footprint Charts,,119,24,https://v.redd.it/rbf5y9m3onke1
1740211402.0,1ivdved,Using Level-II data for trading,"For all using Level-II data for trading US stocks and options, what are the typical market data subscriptions that you use?",5,9,https://www.reddit.com/r/Daytrading/comments/1ivdved/using_levelii_data_for_trading/
1740210863.0,1ivdqq7,"Feeling quite discouraged, anyone else in the same boat?","    I’m working on developing a strategy right now with API data from Schwab, but I can’t help but think that it won’t be possible to be profitable from all of this. As an individual / retail trader it seems too difficult to find edge in the market. I don’t have access to the PHD quants and HFT algorithms that Hedges have access to. 
    Everyone that says the are profitable here is either on a short luck streak, lying, or about to martin gale themselves to death. 
   I’d like to be able to have a true reliable reference from somebody that has proof of their success in a modern market. I’m not asking for a strategy here 
  Comments:”they are hard to find because they would never share their strategy”
 — but all I want is some decent proof from Atleast a single individual that has developed and is still utilizing statistical edges to beat the market.

(Edit: I’d also like to note that I’m against discretionary trading as I believe if you have a robust system there is nothing stopping you from automating it * discretion should only be used in sentiment analysis)",0,23,https://www.reddit.com/r/Daytrading/comments/1ivdqq7/feeling_quite_discouraged_anyone_else_in_the_same/
